{"added_block_tokens":null,"arm":"P_FULL_PLAN_REPLAY_RAW","attempt_index":0,"attended_prompt_tokens":null,"attention_mask_hash":null,"base_prompt_hash":null,"base_task_id":"bw-00000001","candidate_source":"PLAN_REPLAY","candidate_typed_action":{"action":"PICK_UP","args":[{"ref":"@B0","role":"block"}],"schema_version":"work-planner/1.21"},"canonical_task_hash":"sha256:4bc31371bbe18b7bcfffc79ca84c093a620fdf67885b5a3de11b011c0ab79e1f","chat_template_hash":null,"compatible_intent_ids":null,"control_certification_hash":null,"control_mapping_hash":null,"control_source_intent_id":null,"episode_id":"episode-1","episode_plan_manifest_hash":"sha256:4444444444444444444444444444444444444444444444444444444444444444","experiment_freeze_hash":"sha256:5555555555555555555555555555555555555555555555555555555555555555","goal_hash":"sha256:674f6119f49c3bb51100929085deed6106a4ab49da8084cbf3e31ce935a4e728","guidance_block_token_ids_hash":null,"guidance_source_position_index":null,"guidance_source_semantic_ref":null,"guidance_source_step_id":null,"inference_ms":null,"intent_compatibility_hash":null,"intent_text_hash":null,"issue_code":null,"mask_applied":false,"mask_hash":null,"matched_control_tokens":null,"model_id":null,"model_revision":null,"oracle_distance_after":null,"oracle_distance_before":null,"padded_sequence_length":null,"padding_side":null,"pair_group_hash":"sha256:24ee6c09e9f08dcc3e682068e885eb1d6595435a0a1f4a03413c2d3b82cf769b","parse_status":"NOT_APPLICABLE","parsed_llm_response":null,"parsed_typed_action":null,"plan_artifact_hash":"sha256:3333333333333333333333333333333333333333333333333333333333333333","plan_content_hash":"sha256:2222222222222222222222222222222222222222222222222222222222222222","plan_generation_status":"READY","plan_position_index":0,"plan_step_id":"S00","planner_checkpoint_sha256":"sha256:1111111111111111111111111111111111111111111111111111111111111111","planner_config_sha256":"sha256:2222222222222222222222222222222222222222222222222222222222222222","planner_seed":202,"planner_support_signature_hash":"sha256:3333333333333333333333333333333333333333333333333333333333333333","planner_support_status":"STRUCTURAL_SIGNATURE_SEEN","position_ids_hash":null,"progress_success":null,"prompt_artifact":null,"prompt_hash":null,"prompt_token_ids_hash":null,"prompt_tokens_total":null,"queue_ms":null,"raw_output":null,"raw_output_bytes_hash":null,"raw_unmasked_action":"PICK_UP","raw_unmasked_args":["@B0"],"replanning_observed":false,"replay_context":"STAGE1B_E1","rollout_mode":"RAW","run_id":"run-1","schema_version":"work-planner/1.21","semantic_artifact_hash":null,"semantic_bank_hash":null,"semantic_margin":null,"semantic_min_margin":null,"semantic_min_similarity":null,"semantic_ref":null,"semantic_resolution_method":null,"semantic_resolution_status":"NOT_APPLICABLE","semantic_top1_intent_id":null,"semantic_top1_similarity":null,"semantic_top2_intent_id":null,"semantic_top2_similarity":null,"snapshot_id":null,"split":"stage1b_pilot","stage":"STAGE1B_END_TO_END","state_after_hash":"sha256:2222222222222222222222222222222222222222222222222222222222222222","state_before_hash":"sha256:041ef301971bd357cf70a272e7edcf727b7a1e2c8d4bf366d0df224b3c65faa3","state_source":"ACTUAL_TRAJECTORY","step_index":0,"task_id":"bw-00000001","timestamp":"2026-07-24T12:00:00Z","tokenizer_revision":null,"tokens_in":null,"tokens_out":null,"total_ms":null,"trajectory_id":"trajectory-1","trajectory_policy":"frozen_full_plan","validation_status":"VALID"}
